<xs:schema xmlns:xs="http://www.w3.org/2001/XMLSchema">
    <xs:element name="Users">
        <xs:complexType>
            <xs:sequence>
                <xs:element name="user" minOccurs="0" maxOccurs="unbounded">
                    <xs:complexType>
                        <xs:sequence>
                            <xs:element name="id" type="xs:string"/>
                            <xs:element name="name" type="xs:string"/>
                            <xs:element name="userName" type="xs:string"/>
                            <xs:element name="password" type="xs:string"/>
                            <xs:element name="role" type="xs:string"/>
                        </xs:sequence>
                    </xs:complexType>
                </xs:element>
            </xs:sequence>
        </xs:complexType>
    </xs:element>
</xs:schema>